{"schema_version":"1.0","gate":"plan-review","verdict":"ACCEPT","reviewed_commit":"8c265a958d67d3a0424b63444bc529acc8a78f4b","reviewed_boundary":{"base_commit":"8c265a958d67d3a0424b63444bc529acc8a78f4b","candidate_commit":null,"diff_sha256":"4d88e22a69998dda565afb405d16cf31c8435069c03bfe5c1bee038a9627bb12","artifact_hashes":{"specs/18-2-navigate-prepared-java-source-with-restricted-jdt-ls/contracts/navigation-tool.md":"88a1912ba0a82e435cc22a30ee42d38440d65675a6200b7458584637d68b5370","specs/18-2-navigate-prepared-java-source-with-restricted-jdt-ls/data-model.md":"c57673714295faaa45ecc23a278c6523dc1875cde71daacdcbc5bd42a854b80c","specs/18-2-navigate-prepared-java-source-with-restricted-jdt-ls/plan.md":"9aaa35808937598c547510ceb5d463d6f71189fb8f5a00b92cd99956936d255c","specs/18-2-navigate-prepared-java-source-with-restricted-jdt-ls/quickstart.md":"6b4170ed719855d9f3fbef1706f56c23076d94b22fce542fe4186021de48de10","specs/18-2-navigate-prepared-java-source-with-restricted-jdt-ls/research.md":"047587470bce713dcfd77c265720c4d975f9d43ce226ded1f9cd7c2c91c33e7c","specs/18-2-navigate-prepared-java-source-with-restricted-jdt-ls/spec.md":"ed4d49c3917278113f5ede502fdb32c36772af4a3d8c47d2981583d9007cb575"},"owned_paths":["specs/18-2-navigate-prepared-java-source-with-restricted-jdt-ls/spec.md","specs/18-2-navigate-prepared-java-source-with-restricted-jdt-ls/plan.md","specs/18-2-navigate-prepared-java-source-with-restricted-jdt-ls/research.md","specs/18-2-navigate-prepared-java-source-with-restricted-jdt-ls/data-model.md","specs/18-2-navigate-prepared-java-source-with-restricted-jdt-ls/contracts/navigation-tool.md","specs/18-2-navigate-prepared-java-source-with-restricted-jdt-ls/quickstart.md"]},"reviewed_artifacts":["specs/18-2-navigate-prepared-java-source-with-restricted-jdt-ls/spec.md","specs/18-2-navigate-prepared-java-source-with-restricted-jdt-ls/plan.md","specs/18-2-navigate-prepared-java-source-with-restricted-jdt-ls/research.md","specs/18-2-navigate-prepared-java-source-with-restricted-jdt-ls/data-model.md","specs/18-2-navigate-prepared-java-source-with-restricted-jdt-ls/contracts/navigation-tool.md","specs/18-2-navigate-prepared-java-source-with-restricted-jdt-ls/quickstart.md"],"findings":[],"summary":"Plan-only ACCEPT. P-CODEGRAPH-OWNERSHIP-TRANSITION-01 is resolved by one Story 18.2-owned versioned store and coordinator: durable Creating precedes exclusive entry creation, a non-null observed identity is committed in Ready before use, and GetOwnershipViewAsync supplies only a freshly verified current Ready record to later leases and Story 18.3. VerifiedUnowned requires positive absence; unavailable or transitional state grants no binding. Disposing precedes removal, and Removed is committed and read back only after fresh authority, identity and absence checks. Partial or uncertain transitions quarantine. P-CODEGRAPH-DISPOSITION-AUTHORITY-01 and earlier plan findings remain resolved. The plan preserves Story 18.1's public read contract and JDT's separate state; it does not claim a store implementation or native qualification. Tasks and implementation were not reviewed. diff_sha256 is SHA-256 of canonical sorted path-to-artifact-SHA256 JSON encoded as UTF-8 with a terminal newline."}
