{"schema_version":"1.0","gate":"plan-review","verdict":"ACCEPT","reviewed_commit":"9db9992d15e07d67b2949ea6a707c8307789bb53","reviewed_boundary":{"base_commit":"9db9992d15e07d67b2949ea6a707c8307789bb53","candidate_commit":null,"diff_sha256":"d4d4d6e3df50f97b124a0c45dd9559d90ed1e399e4d38b78a06776feec729628","artifact_hashes":{"specs/18-3-use-native-codegraph-mcp-against-prepared-source/spec.md":"9a53ca9d5d852b61862af2e8448e718e8e0f3dae1f327b5acf5acc395341bf0a","specs/18-3-use-native-codegraph-mcp-against-prepared-source/plan.md":"6e45211c4a2203d62c3df3f0fb8ff375a04a9cd46e5b891ff2ba2a60e7c52f33","specs/18-3-use-native-codegraph-mcp-against-prepared-source/research.md":"5615d6046de90a70644e8df7e34ec505035148db8319add00287a40ccb65b34e","specs/18-3-use-native-codegraph-mcp-against-prepared-source/data-model.md":"5627d57691bbb96ba4a638032cd7b9730d81accc39802953dedf1d15f6ee5e92","specs/18-3-use-native-codegraph-mcp-against-prepared-source/quickstart.md":"3b58d187816639f76e4e087133e196cdf9fdd54921c2fff928d3c8430d1be82f","specs/18-3-use-native-codegraph-mcp-against-prepared-source/contracts/native-codegraph-boundary.md":"c6a7774b884991bda5687201668ad143438c12692f6bfcdaf9a2962ffe88c752","specs/18-3-use-native-codegraph-mcp-against-prepared-source/checklists/requirements.md":"b4585503dee213dd09748135fa5d1072fdd536923cd52a2ecb2e7ad7f4bfca88"},"owned_paths":["specs/18-3-use-native-codegraph-mcp-against-prepared-source/spec.md","specs/18-3-use-native-codegraph-mcp-against-prepared-source/plan.md","specs/18-3-use-native-codegraph-mcp-against-prepared-source/research.md","specs/18-3-use-native-codegraph-mcp-against-prepared-source/data-model.md","specs/18-3-use-native-codegraph-mcp-against-prepared-source/quickstart.md","specs/18-3-use-native-codegraph-mcp-against-prepared-source/contracts/native-codegraph-boundary.md","specs/18-3-use-native-codegraph-mcp-against-prepared-source/checklists/requirements.md"]},"reviewed_artifacts":["specs/18-3-use-native-codegraph-mcp-against-prepared-source/spec.md","specs/18-3-use-native-codegraph-mcp-against-prepared-source/plan.md","specs/18-3-use-native-codegraph-mcp-against-prepared-source/research.md","specs/18-3-use-native-codegraph-mcp-against-prepared-source/data-model.md","specs/18-3-use-native-codegraph-mcp-against-prepared-source/quickstart.md","specs/18-3-use-native-codegraph-mcp-against-prepared-source/contracts/native-codegraph-boundary.md","specs/18-3-use-native-codegraph-mcp-against-prepared-source/checklists/requirements.md","specs/18-3-use-native-codegraph-mcp-against-prepared-source/evidence/user-in-place-design-01.json","specs/18-3-use-native-codegraph-mcp-against-prepared-source/evidence/source-reader-owner-invalidation-01.json","specs/18-3-use-native-codegraph-mcp-against-prepared-source/evidence/spec-source-reader-owner-self-review-01.json","specs/18-3-use-native-codegraph-mcp-against-prepared-source/evidence/plan-source-reader-owner-self-review-01.json","specs/18-3-use-native-codegraph-mcp-against-prepared-source/evidence/plan-source-reader-current-proof-01.json","specs/18-3-use-native-codegraph-mcp-against-prepared-source/evidence/codegraph-startup-inspection-01.json","specs/18-3-use-native-codegraph-mcp-against-prepared-source/evidence/plan-review-01.json","specs/18-3-use-native-codegraph-mcp-against-prepared-source/evidence/plan-review-02.json","specs/18-3-use-native-codegraph-mcp-against-prepared-source/evidence/plan-review-03.json","specs/18-3-use-native-codegraph-mcp-against-prepared-source/evidence/plan-review-04.json","specs/18-3-use-native-codegraph-mcp-against-prepared-source/evidence/plan-review-05.raw.json","specs/18-3-use-native-codegraph-mcp-against-prepared-source/evidence/plan-review-06.raw.json","specs/18-3-use-native-codegraph-mcp-against-prepared-source/evidence/definition-review-01.json","specs/18-3-use-native-codegraph-mcp-against-prepared-source/evidence/definition-review-02.raw.json","src/dotnet/Vulgata.Core/DomainServices/PreparedSourceContracts.cs","src/dotnet/Vulgata.Infrastructure/Source/PreparedSourceReadContext.cs","src/dotnet/Vulgata.Infrastructure/Analysis/CodeGraph/NativeCodeGraphMcpClient.cs","docs/bmad/planning-artifacts/october-release-epics.md","docs/bmad/planning-artifacts/sprint-change-proposal-2026-09-26-october-batch-release.md","docs/bmad/planning-artifacts/architecture/ARCHITECTURE-SPINE.md","docs/bmad/planning-artifacts/prds/prd-vulgata-2026-06-12/prd.md",".specify/memory/constitution.md","AGENTS.md","docs/project-lessons.md"],"findings":[],"summary":"The seven-file hashes match the pinned boundary; the canonical digest is d4d4d6e3df50f97b124a0c45dd9559d90ed1e399e4d38b78a06776feec729628. Read-only deterministic workflow validation returned no errors. Earlier PR-18-3-01 and PR-18-3-02 remain resolved. The revised spec and architecture-classified plan now assign the bounded prepared-source reader and continuation correction to Story 18.3, based on positive app-owned state binding, while preserving Story 18.1’s public three-function contract and ordinary access to unbound same-named source. The plan also explicitly replaces the fixture native client’s path-reopen verification with Story 18.2’s contained read before application-bound disclosure, addressing the design concern behind DR-18-3-01; its historical task finding remains for later task correction and is not accepted as task coverage here. Story 18.2’s exact entry/descendant write capability, positive ownership binding, contained read, and shared file/type boundary remain unverified dependencies. CLI effects, effective child ACL/network confinement, reader behavior, and Vulgata application-bound native invocation remain qualification holds. This ACCEPT is for the current plan only; historical tasks are unmapped and were not reviewed."}
