{"schema_version":"1.0","gate":"plan-review","verdict":"ACCEPT","reviewed_commit":"f31e8c935fe18c7e9aac70b3bb36c47aa010817e","reviewed_boundary":{"base_commit":"f31e8c935fe18c7e9aac70b3bb36c47aa010817e","candidate_commit":null,"diff_sha256":"27149746b6bc7454902d73b2539cf1d1cbf572368ccde587d39fe25c952ad350","artifact_hashes":{"specs/18-2-navigate-prepared-java-source-with-restricted-jdt-ls/contracts/navigation-tool.md":"f84ff4919794921952b9ea6b45f6898882ff4b6c87d3a04ea9deb53e55f4bef4","specs/18-2-navigate-prepared-java-source-with-restricted-jdt-ls/data-model.md":"76fe8e2500ffffeeb415313340a020b738de7edda46c034ad69f8bd006f349ff","specs/18-2-navigate-prepared-java-source-with-restricted-jdt-ls/plan.md":"07330151c24a06c1b739ad77f4aa2f4d1aff5fde1735d2ea8de35ed9285fbf01","specs/18-2-navigate-prepared-java-source-with-restricted-jdt-ls/quickstart.md":"8d20e9a0c8446df3425f89fdf662ad68cb875947913fae657b8a7377c5822ab3","specs/18-2-navigate-prepared-java-source-with-restricted-jdt-ls/research.md":"5e40ed05a9b8a21703cb490187822670d8fbcfdb7e139e27e216280185d3ff5b","specs/18-2-navigate-prepared-java-source-with-restricted-jdt-ls/spec.md":"48289365e7eb8a1b5a5b207032b98c6a268dd8c9a5efcf0d9642b83b64f21e1d"},"owned_paths":["specs/18-2-navigate-prepared-java-source-with-restricted-jdt-ls/spec.md","specs/18-2-navigate-prepared-java-source-with-restricted-jdt-ls/plan.md","specs/18-2-navigate-prepared-java-source-with-restricted-jdt-ls/research.md","specs/18-2-navigate-prepared-java-source-with-restricted-jdt-ls/data-model.md","specs/18-2-navigate-prepared-java-source-with-restricted-jdt-ls/contracts/navigation-tool.md","specs/18-2-navigate-prepared-java-source-with-restricted-jdt-ls/quickstart.md"]},"reviewed_artifacts":["specs/18-2-navigate-prepared-java-source-with-restricted-jdt-ls/spec.md","specs/18-2-navigate-prepared-java-source-with-restricted-jdt-ls/plan.md","specs/18-2-navigate-prepared-java-source-with-restricted-jdt-ls/research.md","specs/18-2-navigate-prepared-java-source-with-restricted-jdt-ls/data-model.md","specs/18-2-navigate-prepared-java-source-with-restricted-jdt-ls/contracts/navigation-tool.md","specs/18-2-navigate-prepared-java-source-with-restricted-jdt-ls/quickstart.md"],"findings":[],"summary":"Plan-only ACCEPT for the corrected definition. I read the ordered raw plan-review-result-01.json through -11.json and definition-review-result-01.json through -07.json; their prior PATH, launch-order, partial-open, runtime-settings, cleanup-authority and positive-ownership findings remain resolved. Current Story 18.2 FR-012 and SC-007, the plan and the callable contract consistently limit the shared lease's write guarantee to application-controlled operations. The ownership-store bytes remain unavailable through ordinary model-visible Worker tools, while the plan expressly acknowledges that the trusted pinned CodeGraph child inherits host filesystem rights and may access those bytes; neither the lease nor store placement is presented as preventive OS isolation. Story 18.3 owns observation of native effects, readiness denial for out-of-footprint or protected-source changes, reader repair and residual external/network risk reporting. JDT retains its distinct restricted process profile and separate state; Story 18.1's public read contract is unchanged. The later narrow human O-NFR01 exception was acknowledged in Story 18.3 chat turn 01a0f00c-8d44-7583-b742-6ffb5e2ce23d; the delegate's NEEDS CLARIFICATION is not approval. The canonical October O-NFR01 wording still states broad denial and must be reconciled by the root/shared authority owner before integrated acceptance. This review does not grant planned-change authorization, implementation approval or execution permission, and it does not judge the still-stale tasks. Read-only plan analysis found no new material spec/plan inconsistency; deterministic explicit implementation-design validation returned zero errors. diff_sha256 is SHA-256 of canonical sorted path-to-artifact-SHA256 JSON encoded as UTF-8 with a terminal newline."}
