{
  "schema_version": "1.0",
  "gate": "acceptance-review",
  "verdict": "ACCEPT",
  "reviewed_commit": "e1b75e4eec1dd245834a9af90dc1bf304962c03e",
  "reviewed_boundary": {
    "base_commit": "e1b75e4eec1dd245834a9af90dc1bf304962c03e",
    "candidate_commit": null,
    "diff_sha256": "874256ed5066a7b91d9c4915ed28396f89d04f2454e8d2a741b3a5ae33882c7a",
    "artifact_hashes": {
      "docs/bmad/implementation-artifacts/4-1-codegraph-integration-and-code-unit-extraction.md": "8439e9a1e539714ae2fa4eeb737c07f3e3d0874a3c071eae3a868b243edd6fff",
      "specs/001-codegraph-extraction/spec.md": "07b3676695965bc80805ed72b6714be8f17c62c220eaf4f29ef716ed8fba6d49",
      "specs/001-codegraph-extraction/plan.md": "8c93567823b1c20ad81c212cd6d346831d0623fe9ee7eecbf5f305cb9ba68663",
      "specs/001-codegraph-extraction/tasks.md": "8a164d118073add48ca4d662ace5e2ae0623dc49c4ee0e79c593d7959c44ed69",
      "src/dotnet/Vulgata.Infrastructure/Git/GitWorkingCopyService.cs": "42fdc30df8536ff7120299fbfea0878113cdc2dff7536f69ea6846addd162b37",
      "src/dotnet/Vulgata.Web/Data/RepositoryProfilingCoordinator.cs": "7db4a315b8fd47f7a9caa3cb1ba22b2f0997e5b1fe0e3f4f352ff2b4455fdf1a",
      "tests/Vulgata.Tests/RepositoryProfilingTests.cs": "098975045a650142087517e7f3ce6fe8db73707f045565d056d97b4bedc5fc2f"
    },
    "owned_paths": [
      "src/dotnet/Vulgata.Infrastructure/Git/GitWorkingCopyService.cs",
      "src/dotnet/Vulgata.Web/Data/RepositoryProfilingCoordinator.cs",
      "tests/Vulgata.Tests/RepositoryProfilingTests.cs"
    ]
  },
  "reviewed_artifacts": [
    "docs/bmad/implementation-artifacts/4-1-codegraph-integration-and-code-unit-extraction.md",
    "docs/bmad/epics.md",
    "docs/bmad/planning-artifacts/prds/prd-vulgata-2026-06-12/prd.md",
    "docs/bmad/planning-artifacts/architecture/scanning-v1-technical-plan.md",
    "docs/UBIQUITOUS_LANGUAGE.md",
    "specs/001-codegraph-extraction/spec.md",
    "specs/001-codegraph-extraction/plan.md",
    "specs/001-codegraph-extraction/research.md",
    "specs/001-codegraph-extraction/data-model.md",
    "specs/001-codegraph-extraction/quickstart.md",
    "specs/001-codegraph-extraction/contracts/repository-profiling-api.md",
    "specs/001-codegraph-extraction/tasks.md",
    "specs/001-codegraph-extraction/qualification/evidence/verification.md",
    "specs/001-codegraph-extraction/reviews/acceptance-review-1.json",
    "src/dotnet/Vulgata.Core/DomainServices/IScanRunRepository.cs",
    "src/dotnet/Vulgata.Core/DomainServices/RepositoryProfilingContracts.cs",
    "src/dotnet/Vulgata.Core/Entities/CodeUnit.cs",
    "src/dotnet/Vulgata.Core/Entities/ScanRun.cs",
    "src/dotnet/Vulgata.Core/Entities/ScanStructuralRecords.cs",
    "src/dotnet/Vulgata.Infrastructure/CodeGraph/CodeGraphContextProvider.cs",
    "src/dotnet/Vulgata.Infrastructure/Git/GitWorkingCopyService.cs",
    "src/dotnet/Vulgata.Infrastructure/Git/CommittedRepositorySnapshotService.cs",
    "src/dotnet/Vulgata.Infrastructure/Git/ScanCandidateEnumerator.cs",
    "src/dotnet/Vulgata.Infrastructure/Data/ScanRunRepository.cs",
    "src/dotnet/Vulgata.Shared/Repositories/ScanRunSummaryDto.cs",
    "src/dotnet/Vulgata.Web/Api/Repositories/RepositoryApiEndpoints.cs",
    "src/dotnet/Vulgata.Web/Components/Management/Repositories/RepositoryDetailDialog.razor",
    "src/dotnet/Vulgata.Web/Data/RepositoryProfilingCoordinator.cs",
    "tests/Vulgata.Tests/CodeGraphContextProviderTests.cs",
    "tests/Vulgata.Tests/CodeGraphProviderContractTests.cs",
    "tests/Vulgata.Tests/RepositoryApiTests.cs",
    "tests/Vulgata.Tests/RepositoryProfilingTests.cs",
    "tests/Vulgata.Tests/ScanCandidateEnumeratorTests.cs"
  ],
  "findings": [],
  "summary": "ACCEPT: the exact uncommitted boundary was independently reverified at HEAD e1b75e4eec1dd245834a9af90dc1bf304962c03e; all seven supplied artifact hashes and the raw-byte three-path diff hash matched. The unchanged implementation and raw evidence continue to satisfy AC-1 through AC-6, including authorised whole-Repository profiling, the 1,800-second bound, atomic provider failure with retained filtered audit, traceable Code Units and structural relationships, filtering, progress, authorization, and the exact pinned CodeGraphContext 0.5.1 contract. AR41-001 is closed: Git diagnostics are reduced to the bounded secret-safe detail `Git 命令执行失败，请检查仓库地址和访问权限。`; the coordinator returns and persists `仓库克隆失败：Git 命令执行失败，请检查仓库地址和访问权限。`, marks the ScanRun failed, logs the failure, and adversarial coverage proves credentials, source, paths, tokens, and raw diagnostics are absent. AR41-002 is closed: the missing-provider branch emits an Error log containing the literal `CodeGraph CLI not found`, while retaining the Simplified-Chinese user and persisted message `本地 CodeGraph 服务不可用，请联系管理员。`, the failed ScanRun, filtered audit, and zero provider-derived structural records. The working-copy remote-rebinding correction remains inside Story 4.1 source-acquisition scope and preserves repository identity, profiled revision, clean-checkout and secret-safe behavior; no Worker Agent, orchestration, document, Uncertainty, Cross-Repository Resolution, API, migration, or unrelated product scope was added."
}
