{
  "schema_version": "1.0",
  "gate": "quality-review",
  "verdict": "ACCEPT",
  "reviewed_commit": "af309a72955f54df140d232045b7ae4e1fec86ff",
  "reviewed_boundary": {
    "base_commit": "76e4c9a07d0d9689d0c958ba46c5baaad7d87bd2",
    "candidate_commit": "fc6c97679494dcd7cb54a49e6245df9ced227901",
    "diff_sha256": "3a1a00b66147278bbc37a0ce0ceadd95e9100f1ac4de0b32fd2bae215047c051",
    "artifact_hashes": {
      "specs/010-durable-scan-foundation/spec.md": "da24f90063d0b66d50d642bed8d1e1709257c6bf8b0b42e4ae89929ce5feefb2",
      "specs/010-durable-scan-foundation/plan.md": "389426ad17ddc65971f3f29e1ce06b18483346e45e38a33a7c13a2f298652637",
      "specs/010-durable-scan-foundation/tasks.md": "943041b97cea44cfcef7c692a24655d79cd91ca3886cb8258d8cdad2408eb4e1",
      "specs/010-durable-scan-foundation/contracts/durable-scan-contracts.md": "53b7adeaf7ae54c0880c0423173034445178a330170287e0ee82f1c842465ab8",
      "docs/bmad/implementation-artifacts/12-1-durable-scan-foundation-and-analysis-runtime.md": "a208bafc15aa50c25f355c4bc0f4a314d245fe1e3af603b5f077f190ce035c3b",
      "src/dotnet/Vulgata.Infrastructure/Data/DurableScanRepository.cs": "b0cfce5c994175ae23b1c835a32f35ac9f83025f3b478d6eb677d7b65ac31f26",
      "tests/Vulgata.Tests/Migrations/DurableScanConcurrencyPostgreSqlTests.cs": "a62545b72f43fbab850e8492b5929305832c51f5977e32198bb25f8398771b57"
    },
    "owned_paths": [
      "src/dotnet/Vulgata.Core/DomainServices/DurableScanContracts.cs",
      "src/dotnet/Vulgata.Core/DomainServices/IDurableScanStore.cs",
      "src/dotnet/Vulgata.Infrastructure/Data/DurableScanRecoveryCoordinator.cs",
      "src/dotnet/Vulgata.Infrastructure/Data/DurableScanRepository.cs",
      "src/dotnet/Vulgata.Infrastructure/Data/KnowledgeStoreRepository.cs",
      "src/dotnet/Vulgata.Web/Api/Scans/ManualResumeEndpoints.cs",
      "src/dotnet/Vulgata.Web/Program.cs",
      "tests/Vulgata.Tests/DurableScanning/DurableScanContractTests.cs",
      "tests/Vulgata.Tests/DurableScanning/DurableScanStoreTests.cs",
      "tests/Vulgata.Tests/DurableScanning/RecoveryCoordinatorTests.cs",
      "tests/Vulgata.Tests/DurableScanning/AtomicDocumentJobCommitTests.cs",
      "tests/Vulgata.Tests/DurableScanning/RuntimeScanRecoveryRevalidationTests.cs",
      "tests/Vulgata.Tests/DurableScanning/ManualResumeApiTests.cs",
      "tests/Vulgata.Tests/DurableScanning/DurableScanRestartPostgreSqlTests.cs",
      "tests/Vulgata.Tests/Migrations/DurableScanMigrationPostgreSqlTests.cs",
      "tests/Vulgata.Tests/Migrations/DurableScanConcurrencyPostgreSqlTests.cs"
    ]
  },
  "reviewed_artifacts": [
    "AGENTS.md",
    ".specify/memory/constitution.md",
    "docs/agent-workflow/artifact-contracts.md",
    "docs/agent-workflow/review-and-correction.md",
    "docs/agent-workflow/e2e-decision-matrix.md",
    "docs/UBIQUITOUS_LANGUAGE.md",
    "docs/bmad/planning-artifacts/sprint-change-proposal-2026-08-17-august-30-bounded-scanning-recovery.md",
    "docs/bmad/planning-artifacts/sprint-change-proposal-2026-08-18-august-demo-host-runtime-and-jdtls-pin.md",
    "docs/bmad/planning-artifacts/architecture/august-30-bounded-scanning-design.md",
    "docs/bmad/planning-artifacts/prds/prd-vulgata-2026-06-12/prd.md",
    "docs/bmad/planning-artifacts/architecture.md",
    "docs/bmad/epics.md",
    "docs/bmad/implementation-artifacts/12-1-durable-scan-foundation-and-analysis-runtime.md",
    "specs/010-durable-scan-foundation/spec.md",
    "specs/010-durable-scan-foundation/plan.md",
    "specs/010-durable-scan-foundation/research.md",
    "specs/010-durable-scan-foundation/data-model.md",
    "specs/010-durable-scan-foundation/quickstart.md",
    "specs/010-durable-scan-foundation/tasks.md",
    "specs/010-durable-scan-foundation/contracts/analysis-runtime-contracts.md",
    "specs/010-durable-scan-foundation/contracts/durable-scan-contracts.md",
    "specs/010-durable-scan-foundation/contracts/manual-resume-api.md",
    "specs/010-durable-scan-foundation/reviews/quality-review/quality-review-01.json",
    "specs/010-durable-scan-foundation/reviews/quality-review/quality-review-02.json",
    "specs/010-durable-scan-foundation/reviews/quality-review/quality-review-03.json",
    "specs/010-durable-scan-foundation/reviews/quality-review/quality-review-04.json",
    "specs/010-durable-scan-foundation/workflow-state.json",
    "src/dotnet/Vulgata.Core/DomainServices/DurableScanContracts.cs",
    "src/dotnet/Vulgata.Core/DomainServices/IDurableScanStore.cs",
    "src/dotnet/Vulgata.Infrastructure/Data/DurableScanRecoveryCoordinator.cs",
    "src/dotnet/Vulgata.Infrastructure/Data/DurableScanRepository.cs",
    "src/dotnet/Vulgata.Infrastructure/Data/KnowledgeStoreRepository.cs",
    "src/dotnet/Vulgata.Infrastructure/Data/Migrations/20260818124712_AddDurableScanFoundation.cs",
    "src/dotnet/Vulgata.Web/Api/Scans/ManualResumeEndpoints.cs",
    "src/dotnet/Vulgata.Web/Program.cs",
    "tests/Vulgata.Tests/DurableScanning/DurableScanContractTests.cs",
    "tests/Vulgata.Tests/DurableScanning/DurableScanStoreTests.cs",
    "tests/Vulgata.Tests/DurableScanning/RecoveryCoordinatorTests.cs",
    "tests/Vulgata.Tests/DurableScanning/AtomicDocumentJobCommitTests.cs",
    "tests/Vulgata.Tests/DurableScanning/RuntimeScanRecoveryRevalidationTests.cs",
    "tests/Vulgata.Tests/DurableScanning/ManualResumeApiTests.cs",
    "tests/Vulgata.Tests/DurableScanning/DurableScanRestartPostgreSqlTests.cs",
    "tests/Vulgata.Tests/Migrations/DurableScanMigrationPostgreSqlTests.cs",
    "tests/Vulgata.Tests/Migrations/DurableScanConcurrencyPostgreSqlTests.cs"
  ],
  "findings": [],
  "summary": "ACCEPT. Independent quality review iteration 5 re-observed demo0831/main at checkpoint af309a72955f54df140d232045b7ae4e1fec86ff with an empty index and only preserved untracked .run/. The implementation boundary remains 76e4c9a07d0d9689d0c958ba46c5baaad7d87bd2 through fc6c97679494dcd7cb54a49e6245df9ced227901 with canonical Git-diff SHA-256 3a1a00b66147278bbc37a0ce0ceadd95e9100f1ac4de0b32fd2bae215047c051; git diff --check passed. QR-001, QR-002, QR-003, and QR2-001 remain closed. QR4-001 is closed: each execution-strategy attempt clears prior tracked recovery state before opening one Serializable transaction, reauthorizes and rehydrates the Scan Execution plus complete bound Scan Job Execution membership, validates completed-Document linkage, captured versions, transition timing, and canonical state, then performs at most one SaveChanges and commit. A rolled-back transient attempt starts from fresh durable state; an acknowledgement-lost commit retries into mutation-free Replay only when the execution version/phase/timestamp/cleared pause fields and every job version/state/timestamp/cleared lease-retry-failure-document shape exactly match the captured batch. NoChange jobs retain their exact captured version and valid completion linkage; non-identical state returns Conflict or rejection. Caller cancellation propagates and the transaction rolls back. The two real PostgreSQL interceptors faithfully inject SQLSTATE 40001 after SaveChanges but before commit and after the database commit acknowledgement, respectively. Independently rerun PostgreSQL retry tests passed 6/6; the adjacent Durable Scanning and migration boundary passed 135/135 with zero skipped tests and zero residual vulgata_story121_ databases; Vulgata.Web built with 0 errors and 9 known package/reference warnings. The context-wide ChangeTracker.Clear is broader than an isolated retry context and would discard unrelated pending tracked changes if a future caller shares this scoped VulgataDbContext as a unit of work; the current production recovery path performs only reads before this call, so this is a truthful non-blocking architecture limitation rather than an observed Story 12.1 correctness failure. The acknowledgement-loss test permits Applied or Replay although the inspected retry path returns Replay; static inspection plus exact durable state assertions close the product requirement, but tightening that assertion would improve test precision. E2E remains REQUIRED because the story changes authentication/authorization, API, persistence, migration/data lifecycle, and multi-module runtime behavior; rerun current-boundary PostgreSQL 17 migration/restart/concurrency/atomicity, manual-resume authorization, and installed CodeGraph/JDT-LS qualification before final verification."
}
